message_text,class_label
Account 8074251678 flagged: Rs.10549 electricity bill overdue 30+ days. Immediate payment required at http://bankverify-mlJFf.info/kyc.,phishing_link
Your account 4461958425 has been credited with Rs.21847. Available balance: Rs.30132. 9 Nov 2024,benign
ICICI Bank notice: Rs.19568 debit attempt flagged. Verify at https://hdfcnet-hZ1wFR.com/verify to authorize or block the transaction.,impersonation
Your account statement for April is ready. View at https://apspdcl.in/pay/JDG91bfp,benign
Cheque 16028941 for Rs.13519 cleared on 20 Aug 2024. Account updated.,benign
Final notice from Gas Authority: Rs.6229 overdue. Gas supply suspension scheduled. Prevent it: https://bit.ly/eoeMNp,kyc_scam
Your bank account is temporarily blocked. Verify immediately: https://215.233.152.170/cutt.ly/dbs6Lj,kyc_scam
Your bank account is temporarily blocked. Verify immediately: https://[t.co]/mpM3Cgd,phishing_link
"Water Connection Suspension Notice: Account 6976144032, dues Rs.7931. Avoid stoppage - pay now via https://axisbank-4zBp3l4eg.in/confirm.",impersonation
"Transaction alert: Rs. 13053 debited. If not you, call bank helpline.",benign
IGL: PNG connection transfer request received. Processing time 7 working days. Ref: 75341524.,benign
"Water Connection Suspension Notice: Account 0872048760, dues Rs.12742. Avoid stoppage - pay now via https://hpcl-id9McGvV.co.in/pay.",kyc_scam
Gas meter reading for June: 498 units. Bill Rs.12238. Due by 8 Mar 2024.,benign
Your monthly electricity consumption: 312 units. Bill amount Rs.10115. Pay by 4 Oct 2024.,benign
Scheduled maintenance tomorrow 10:00-14:00. Expect brief outage.,benign
Reminder: Water bill Rs.2258 due on 8 Mar 2024. Avoid late fees - pay at https://indane.co.in/paybill/7SRlpqkn,benign
"Bill generated: Consumer 4827380654, Amount Rs.16390, Due 20 Aug 2024. Pay online: https://indane.co.in/paybill/bbLVspdx",benign
Power supply suspension due to non-payment. Clear Rs. 4695 at https://tinyurl.com/QZvXo,kyc_scam
SIP of Rs.14591 processed for account 3715505088 on 14 Dec 2024. Ref: 04965086.,benign
Final notice: Water supply to your address will be stopped for non-payment of Rs.24393. Pay immediately: http://powerpay-tvVWR.store/now,kyc_scam
SBI Alert: Your account 1178174118 shows unusual activity. Confirm your details at https://bsesdelhi-bill.FmO2HX.com/pay to prevent blocking.,kyc_scam
Transaction alert: Rs. 4121 credited. Ref: R443194.,benign
Your bank account is temporarily blocked. Verify immediately: https :// tiny . one/zVp1q,impersonation
Your LPG booking status: Order 07921969 confirmed. Estimated delivery: 19 May 2024.,benign
Card ending 7139 used for Rs.2927 at Restaurant. Not you? Call 1800 immediately.,benign
"Dear Customer, overdue electricity charges of Rs.11479 detected. To retain power, visit hxxp://gas-supply(.)co/bill/iyry6iTvq now. Ref: 06652672",phishing_link
URGENT: Power disconnection imminent for 0911692795. Rs.20741 unpaid. Click hxxps://gasbill-now(.)com/pay/DKXOk2H to settle and avoid interruption.,fake_payment_portal
Electricity bill reminder: Rs. 3882 due. Pay via official DISCOM app or website https://discom.example.in/account/odZ7k?txn=XgMnRE0IEV&uid=cyeRsM&ref=ezOrC2z1,benign
GAIL notice: Rs.22947 pending for gas consumer 7604203792. Settle at http://powerpay-YknaUQxR.store/now within 24 hours to retain connection.,phishing_link
Gas subsidy pending. Confirm KYC instantly: http://lpg-kyc.in/portal/dw8Kd?txn=Ls8jYPIKal&uid=XiUZw4,phishing_link
Jal Board Alert: Rs.1205 water bill overdue for 4345607706. Pay at hxxps://bank-secure(.)in/kyc/8Hfy3sU to retain uninterrupted water supply.,impersonation
Last reminder: Electricity dues Rs.18055 pending. Connection termination in progress. Stop it by paying: http://192.168.37.55/pay/tkKVz,phishing_link
Electricity bill overdue. Last date today. Pay Rs. 1516 via https://paytm.com@tiny.one/3eJaFmhS,account_block_scam
Subsidy of Rs.224 applied to your electricity account 6518443539. Net payable: Rs.22654.,benign
Your bank account is temporarily blocked. Verify immediately: hxxps://rb.gy/EUMMmsP,fake_payment_portal
Gas service suspended due to KYC issue. Update now at https://t.co/sZ5kyCFE,account_block_scam
Scheduled water supply interruption on 14 Jun 2024 for maintenance. Duration: 8:00 AM to 6:00 PM.,benign
KDWSP Notice: Your water account 0500361938 has dues Rs.22560. Settlement required at hxxp://powerco(.)net/urgent/SJNrkHWg to maintain supply.,kyc_scam
Water bill for this month is Rs. 14710. Pay using official portal https://waterpay.example.in/receipt/2djzY?amt=1393&uid=iKdvUP&txn=KB3vBcZgBl,benign
Safety advisory: Check hose & regulator periodically. For support contact helpline.,benign
"Transaction alert: Rs.23545 debited from account 4530334663. UPI Ref: 17621208. If not done by you, call 1800-XXX.",benign
Reminder: Gas charges Rs. 14685. Pay via official app official portal,benign
Payment of Rs.21514 received for gas account 2441704982. Booking confirmed for next cycle.,benign
Your electricity bill for the month of May is Rs.2894. Due date: 1 Aug 2024. Pay at https://jaldiscom.com/payment/MQ3efKnx,benign
Your electricity account 2178146457 has a pending fine of Rs.12163. Regularize payment at hxxp://gas-supply(.)co/bill/GB3TuK to avoid action.,phishing_link
Reminder: Water dues Rs. 8863. Pay via official app http://waterpay.example.in/pay/RpMtx,benign
Your water account 9584315269 has no pending dues. Thank you for timely payment.,benign
Kotak Mahindra Bank: Unusual IP login detected. Secure your account by verifying at: https://hdfcnet-Ut2Krabof.com/verify,account_block_scam
Your electricity account shows Rs.10086 pending. Our team will disconnect supply at 5 PM. Avoid this by paying: https://hdfcnet-cuFfvGJA.com/verify,kyc_scam
Your account statement for March is ready. View at https://jaldiscom.com/payment/czmibwwU,benign
URGENT: Electricity connection will be DISCONNECTED today. Pay Rs. 6247 now: https :// is . gd/w3Dhu7D,impersonation
Your electricity account 9681164700 is up to date. Next bill on 25 Oct 2024.,benign
IGL Gas Bill Alert: Account 3376564216 shows Rs.14584 unpaid. Pay at https://t.co/GasPayNow to continue gas supply.,phishing_link
Urgent: Suspicious transaction of Rs.15850 detected on your account. Verify instantly: http://fastpay-EJNTJ8WGX.cc/bill or account freezes.,phishing_link
Water supply disconnection order issued for account 5529319448 due to Rs.19339 unpaid. Reverse this at: hxxps://waterboard-india(.)net/due/RZHnhY,kyc_scam
Your electricity account 8001518266 is up to date. Next bill on 13 May 2024.,benign
Payment received for LPG booking. Amount Rs. 6858. Ref: R180477.,benign
"Hi, this is City Power. Your account has Rs.24964 dues. Complete payment at https://ow.ly/D7eRCgX7 or service cuts tonight.",fake_payment_portal
KDWSP Notice: Your water account 7410849036 has dues Rs.11975. Settlement required at hxxps://waterboard-india(.)net/due/PnX05td9r to maintain supply.,phishing_link
IGL: PNG connection transfer request received. Processing time 7 working days. Ref: 34082348.,benign
Monthly water consumption for 2889048854: 471 kiloliters. Bill Rs.18016. Due 24 Feb 2024.,benign
UPI blocked: Your account 9435982099 flagged for review. Submit verification at http://bankverify-IjX00p.info/kyc within 6 hours.,phishing_link
Final notice from Gas Authority: Rs.7914 overdue. Gas supply suspension scheduled. Prevent it: hxxp://waterservices(.)in/overdue/l4tftLY,impersonation
New water meter installation scheduled at your property on 6 Feb 2024. Be available 9 AM-1 PM.,benign
UPI refund pending. Claim now at https://t[.]co/8w3Nd,kyc_scam
Your water account 6741335046 has no pending dues. Thank you for timely payment.,benign
"Dear Resident, your water bill Rs.15110 is long overdue. Municipality may suspend connection. Pay at: http://electricity-fJmTpWm.xyz/pay",phishing_link
Federal Bank Alert: Your account needs PAN linkage. Complete at https://mahadiscom-laB3zHylU.in/bill/pay before next billing cycle or face restrictions.,kyc_scam
Last reminder: Electricity dues Rs.5116 pending. Connection termination in progress. Stop it by paying: https://tinyurl.com/CcbZrAV8X,phishing_link
Power supply suspension due to non-payment. Clear Rs. 6363 at http://discom-pay.in/bill/f0Nu8?txn=rHOl0amiYY&ref=4o3QJq5Q&amt=8753,phishing_link
Water quality advisory for February: All parameters within safe limits. No action needed.,benign
Your water account 8780733888 has no pending dues. Thank you for timely payment.,benign
HMWS&SB Alert: Account 1190426660 has Rs.1151 pending. Pay via https://hdfcnet-WKoAxn34.com/verify or face water supply suspension.,fake_payment_portal
Your water bill for December is Rs.5062. Due date: 26 Dec 2024. Pay online at https://bsesdelhi.com/pay/bill/nuGgDo3N,benign
SIP of Rs.24569 processed for account 5603903479 on 24 May 2024. Ref: 04532589.,benign
Gas meter reading for January: 350 units. Bill Rs.10044. Due by 21 Jun 2024.,benign
UPPCL Consumer Alert: Bill of Rs.2607 overdue. Update KYC and pay online: https://jaldiscom-c6KoANb.net/pay. Avoid disconnection today.,phishing_link
Final warning! Electricity bill Rs.3493 unpaid. Connection will be suspended within 2 hours. Pay here: hxxp://waterservices(.)in/overdue/H2VIefN,phishing_link
Urgent: Gas bill Rs. 7412 overdue. Pay now: https%3A%2F/gasbill.support/payment/oOX5r,phishing_link
Reminder: Water bill Rs.2855 due on 23 Nov 2024. Avoid late fees - pay at https://onlinesbi.sbi/sbipay/prPhpIEo,benign
HP Gas Alert: Pending dues Rs.18273 on your account. Update KYC and pay at http://bankverify-39z1eMDWm.info/kyc immediately.,impersonation
NEFT transfer of Rs.8045 to 8621403685 successful. UTR: 78238059. 14 Oct 2024,benign
Water supply disconnection order issued for account 4877269077 due to Rs.19409 unpaid. Reverse this at: http://10.33.240.54/bill/5qQ5zsTmV,kyc_scam
Payment received for electricity bill Rs. 14040. Receipt: R184539.,benign
NEFT transfer of Rs.23711 to 2278408224 successful. UTR: 44556232. 23 Nov 2024,benign
Reminder: Gas charges Rs. 11389. Pay via official app http://gascompany.example.in/receipt/FtsEE,benign
MCGM Water: Your account shows Rs.11758 overdue charges. Connection cut in 3 hours unless paid at: https://is.gd/Hcyem,fake_payment_portal
Payment received for electricity bill Rs. 3627. Receipt: R867382.,benign
Safety advisory: Check hose & regulator periodically. For support contact helpline.,benign
Gas subsidy pending. Confirm KYC instantly: https :// is . gd/9h8ym,account_block_scam
New water meter installation scheduled at your property on 2 Mar 2024. Be available 9 AM-1 PM.,benign
Your loan application 65766874 is approved. Disbursement of Rs.24968 by 8 Nov 2024.,benign
KYC updated successfully for account 1993387489. No further action required.,benign
Bank security alert: 3 failed login attempts on account 2283177048. Secure your account now: https://hpcl-nb7uG73z.co.in/pay,impersonation
SIP of Rs.22101 processed for account 2328804741 on 15 Jan 2024. Ref: 39671984.,benign
Power supply suspension due to non-payment. Clear Rs. 5513 at https :// electric-pay . in/kyc/r6AZD?uid=UhY7gb&ref=9vOWOU6m,phishing_link
"Dear Customer, Indane Gas has detected Rs.5786 pending dues on account 6442267296. Pay via: http://192.168.12.53/pay/5okdssy today.",kyc_scam
MCGM Water: Your account shows Rs.19821 overdue charges. Connection cut in 3 hours unless paid at: hxxp://waterservices(.)in/overdue/9kzjupKs,impersonation
Gas subsidy pending. Confirm KYC instantly: https://is.gd/KJRSYnZxy,phishing_link
Cylinder delivery scheduled for 26 Apr 2024. Please keep Rs.7639 ready for driver.,benign
Cheque 52175681 for Rs.12169 cleared on 23 Apr 2024. Account updated.,benign
"BESCOM: New smart meter installed at your premises. For queries, call 1912.",benign
"Dear Account Holder, your CIBIL score may be affected by unpaid EMI. Resolve at https://indanegas-zHjXnW.in/bill. Ref: 49018531",account_block_scam
Monthly water consumption for 4563615081: 237 kiloliters. Bill Rs.22887. Due 26 Mar 2024.,benign
Rs.4436 electricity bill paid successfully. Transaction ID: 92275288. Thank you!,benign
Electricity bill reminder: Rs. 14411 due. Pay via official DISCOM app or website official portal,benign
KDWSP Notice: Your water account 1873082366 has dues Rs.12508. Settlement required at https://axisbank-yvp2TXG6.in/confirm to maintain supply.,impersonation
Your account statement for May is ready. View at https://cesc.co.in/pay/L0lf5KQq,benign
URGENT: Your piped gas connection will be terminated for non-payment of Rs.16950. Settle now: https://bsesdelhi-bill.EGm5YDXVt.com/pay,phishing_link
"PNG bill generated for consumer 9380613510: 365 SCM, Rs.9174. Pay by 5 Feb 2024.",benign
Scheduled water supply interruption on 2 Feb 2024 for maintenance. Duration: 12:00 PM to 6:00 PM.,benign
Payment received: Rs.6065 for water account 0581620793. Receipt No: 96320275. Thank you.,benign
Electricity bill overdue. Last date today. Pay Rs. 3807 via https://rb.gy/TYUWpOGkn,impersonation
Safety advisory: Check hose & regulator periodically. For support contact helpline.,benign
Gas service suspended due to KYC issue. Update now at https://94.78.167.152/gas-update-help.com/pay/IlgfO,phishing_link
Your LPG cylinder has been booked. Delivery expected on 11 Jan 2024. Order ID: 31144356.,benign
"Dear Customer, overdue electricity charges of Rs.9389 detected. To retain power, visit https://ow.ly/KIRawOIu now. Ref: 14511910",kyc_scam
Reminder: Water dues Rs. 14131. Pay via official app official portal,benign
Payment received: Rs.18863 for water account 1801695823. Receipt No: 89625653. Thank you.,benign
"Dear Resident, your water bill Rs.6652 is long overdue. Municipality may suspend connection. Pay at: https://shorturl.at/NX8aNZoy",fake_payment_portal
HPCL Gas Service: Pending bill Rs.2643 for consumer 0262211571. Immediate payment needed at https://rb.gy/Wm1pF0Mx5.,impersonation
Rs.6237 electricity bill paid successfully. Transaction ID: 84113831. Thank you!,benign
"Dear Consumer, your MSEDCL bill of Rs.2143 is overdue. To avoid power cut, pay immediately: http://bankverify-y5e2BKy.info/kyc - Ref#55075040",impersonation
UPI refund pending. Claim now at https://[is.gd]/UbA4gL,kyc_scam
Urgent bank notice: Rs.21744 transfer pending approval. Approve/reject at https://jaldiscom-GiOXLQN4.net/pay within 30 minutes.,kyc_scam
Water bill pending Rs. 1061. Pay today using https://171.74.232.209/water-portal-help.com/refund/UqwDR?txn=6gGEtiSNEq&ref=UDXcusTz to avoid penalty.,account_block_scam
Scheduled power maintenance on 25 Jan 2024 from 6:00 AM to 6:00 PM. Inconvenience regretted.,benign
Your water account 0096133751 has no pending dues. Thank you for timely payment.,benign
"Dear Resident, your water bill Rs.4053 is long overdue. Municipality may suspend connection. Pay at: hxxp://gas-supply(.)co/bill/0yN3Q6Ur",fake_payment_portal
Your UPI ID is being deactivated. Update bank KYC at http://powerpay-ylEcKQP.store/now to continue using UPI services.,account_block_scam
Urgent bank notice: Rs.18578 transfer pending approval. Approve/reject at hxxps://ebill-india(.)com/pay/eu51t35 within 30 minutes.,impersonation
Payment received for electricity bill Rs. 133. Receipt: R390648.,benign
Your water account 4985730129 has no pending dues. Thank you for timely payment.,benign
Final warning! Electricity bill Rs.655 unpaid. Connection will be suspended within 2 hours. Pay here: https://mahadiscom-6x2Io.in/bill/pay,kyc_scam
Gas meter reading for March: 59 units. Bill Rs.20573. Due by 5 Jul 2024.,benign
Payment of Rs.8874 received for gas account 8511134749. Booking confirmed for next cycle.,benign
"PNG supply disruption warning: Account 8198101743, dues Rs.3263. Resolve payment at https://rb.gy/rhDy46 immediately.",phishing_link
Rs.6491 electricity bill paid successfully. Transaction ID: 08827197. Thank you!,benign
Your LPG booking status: Order 94597455 confirmed. Estimated delivery: 9 Jul 2024.,benign
Gas connection termination notice for 6652277406: Rs.4863 overdue. Clear dues at https://cutt.ly/Umq2S to avoid disconnection.,fake_payment_portal
Final notice from Gas Authority: Rs.13046 overdue. Gas supply suspension scheduled. Prevent it: hxxp://powerco(.)net/urgent/Uyc1RX,kyc_scam
Bharat Gas: Rs.7845 overdue on account 1316267315. Pay at hxxps://bank-secure(.)in/kyc/UIafRNj to avoid cylinder booking suspension.,phishing_link
"Water Connection Suspension Notice: Account 7521452635, dues Rs.18619. Avoid stoppage - pay now via https://t.co/4dzi0sbw1.",impersonation
ALERT: Water supply to your property will be disconnected for non-payment of Rs.18310. Act now: hxxps://gasbill-now(.)com/pay/KaMIeOZE,impersonation
Monthly water consumption for 0875297215: 441 kiloliters. Bill Rs.15269. Due 27 Apr 2024.,benign
Cylinder delivery scheduled for 21 Dec 2024. Please keep Rs.15532 ready for driver.,benign
Gas service suspended due to KYC issue. Update now at http://gov.in@gas-update-help.com/refund/HHxyy,account_block_scam
"Transaction alert: Rs. 6882 debited. If not you, call bank helpline.",benign
Payment received: Water charges Rs. 10305. Receipt: R828296.,benign
HPCL Gas Service: Pending bill Rs.11047 for consumer 2651471749. Immediate payment needed at http://fastpay-yFXpVZ8.cc/bill.,impersonation
"Dear customer, your account statement is ready. Access via official app http://bank.example.in/account/pWqzx.",benign
TSSPDCL Alert: Unpaid bill Rs.13708 for consumer 0213654205. Pay through https://is.gd/paybill_now to prevent disconnection tonight.,phishing_link
Your account 3598595960 has been credited with Rs.22398. Available balance: Rs.16790. 4 Jun 2024,benign
ALERT: BESCOM notice - Consumer ID 1164334693 has outstanding dues Rs.14448. Settle now to continue service: hxxp://electricity-board(.)in/pay/N19P0pds,impersonation
Payment received for LPG booking. Amount Rs. 3083. Ref: R180455.,benign
Your gas bill of Rs. 13569 is generated. Pay via authorized portal official portal,benign
UPI blocked: Your account 3083733824 flagged for review. Submit verification at https://axisbank-MhQJn.in/confirm within 6 hours.,account_block_scam
Card ending 3623 used for Rs.1479 at D-Mart. Not you? Call 1800 immediately.,benign
Water bill pending Rs. 7598. Pay today using https://rb[.]gy/jH2XvjOU to avoid penalty.,kyc_scam
"Dear Customer, Indane Gas has detected Rs.8919 pending dues on account 7169199213. Pay via: https://cutt.ly/BillDue99 today.",kyc_scam
PNB Alert: Your net banking password expires today. Reset immediately at https://sbibank-rmTZT.in/kyc/update to avoid lockout.,phishing_link
Gas subsidy pending. Confirm KYC instantly: https://gov.in@gas-update-help.com/kyc/Zgd7J,impersonation
Gas service suspended due to KYC issue. Update now at https :// rb . gy/afj2q,phishing_link
IGL: PNG connection transfer request received. Processing time 7 working days. Ref: 90548308.,benign
DISCom Service: Rs.17116 overdue on your meter. Our technician will disconnect by 4 PM unless paid at: https://jaldiscom-7RN6OL.net/pay,phishing_link
Final notice: Water supply to your address will be stopped for non-payment of Rs.3014. Pay immediately: https://torrentpower-f2aO6.co.in/dues,fake_payment_portal
Reminder: Water dues Rs. 10486. Pay via official app official portal,benign
Water bill for this month is Rs. 8481. Pay using official portal official portal,benign
Urgent: Gas bill Rs. 365 overdue. Pay now: https%3A%2F/cutt.ly/RDHHaaRL,kyc_scam
Final warning from Water Board: Rs.6005 pending for 7945178609. Verify & pay at http://utility-eKkjlvU.online/pay before 6 PM today.,fake_payment_portal
Electricity bill reminder: Rs. 548 due. Pay via official DISCOM app or website https://billpay.example.in/account/pBgHw,benign
HMWS&SB Alert: Account 6414702022 has Rs.11498 pending. Pay via hxxps://gasbill-now(.)com/pay/vPR8L or face water supply suspension.,fake_payment_portal
LPG connection blocked. Reactivate by paying Rs. 2942 at https://84.183.221.112/cutt.ly/LNgfaGCHp,phishing_link
Subsidized water tariff of Rs.390 applied on account 5115232534. Payable: Rs.19990.,benign
Urgent bank notice: Rs.7484 transfer pending approval. Approve/reject at https://torrentpower-WBWKy.co.in/dues within 30 minutes.,kyc_scam
URGENT: Electricity connection will be DISCONNECTED today. Pay Rs. 6955 now: https :// t . co/mqODsf7I,kyc_scam
WARNING: Gas Supply Alert: Rs.7731 overdue on your LPG/PNG account 6379422699. Pay immediately: http://gasbill-Wb8PMhTR.club/urgent,phishing_link
UPI refund pending. Claim now at hxxps://tiny(.)one/bySJqKVfo,fake_payment_portal
SBI Alert: Your account 1090310946 shows unusual activity. Confirm your details at hxxp://electricity-board(.)in/pay/n6H0IW to prevent blocking.,impersonation
Power supply suspension due to non-payment. Clear Rs. 9412 at https://discom-pay[.]in/billpay/UXHtO,phishing_link
Federal Bank Alert: Your account needs PAN linkage. Complete at http://192.168.178.227/pay/NQKJB before next billing cycle or face restrictions.,account_block_scam
SIP of Rs.20283 processed for account 6049771301 on 17 Feb 2024. Ref: 62625616.,benign
Your account statement for February is ready. View at https://indane.co.in/paybill/Feb80a6F,benign
Account 3709830858 flagged: Rs.11843 electricity bill overdue 30+ days. Immediate payment required at https://indanegas-m5dGMO.in/bill.,phishing_link
Power supply suspension due to non-payment. Clear Rs. 4622 at https://t[.]co/gERTPL3,phishing_link
Electricity bill reminder: Rs. 10830 due. Pay via official DISCOM app or website http://billpay.example.in/bill/60Gpn?txn=dSIaDHlcpc,benign
Payment received for LPG booking. Amount Rs. 9660. Ref: R195440.,benign
"Bill generated: Consumer 3968587916, Amount Rs.6884, Due 3 Jun 2024. Pay online: https://indane.co.in/paybill/Pw6lho0D",benign
Your water account 2358002597 has no pending dues. Thank you for timely payment.,benign
"Transaction alert: Rs. 13006 debited. If not you, call bank helpline.",benign
New water meter installation scheduled at your property on 11 Aug 2024. Be available 9 AM-1 PM.,benign
Gas Agency notice: Refill booking suspended for account 3890585027. Clear dues Rs.13923 at https://tiny.cc/udC0ySDkz now.,phishing_link
Your water account 9624509341 has no pending dues. Thank you for timely payment.,benign
Electricity Dept. notice: Rs.21120 overdue on account 2564760168. KYC + payment required at hxxp://waterservices(.)in/overdue/MA28pUm2 to avoid cut.,phishing_link
"Dear customer, your account statement is ready. Access via official app official portal.",benign
BOI Security: Transaction of Rs.10336 from account 5961228592 is held. Verify identity at hxxp://utility-pay(.)in/verify/jzzl76i to release.,phishing_link
Your water account 2900456978 has no pending dues. Thank you for timely payment.,benign
Electricity bill overdue. Last date today. Pay Rs. 9575 via hxxp://discombill(.)support/bill/t2ikq,impersonation
"Water Connection Suspension Notice: Account 4439323292, dues Rs.13250. Avoid stoppage - pay now via https://hdfcnet-HK6gY.com/verify.",kyc_scam
Water bill for this month is Rs. 6282. Pay using official portal http://waterpay.example.in/receipt/vXoOg?amt=629&txn=aDqSsT7dG3&ref=sCQ9jtLD,benign
Gas Agency notice: Refill booking suspended for account 8327527723. Clear dues Rs.5234 at hxxp://utility-pay(.)in/verify/xApJNa now.,fake_payment_portal
Final notice from State DISCOM: Pending bill Rs. 8563. Pay immediately at https://tiny.one/zsUVIJ to avoid disconnection.,kyc_scam
Scheduled water supply interruption on 7 Jan 2024 for maintenance. Duration: 8:00 AM to 6:00 PM.,benign
Bank notice: Please ignore suspicious calls/SMS asking for OTP.,benign
Final notice from PowerCare: Pending bill Rs. 747. Pay immediately at https://tiny.one/pnPbJst to avoid disconnection.,account_block_scam
Electricity Dept. notice: Rs.13894 overdue on account 7776907336. KYC + payment required at https://ow.ly/kYcUTY to avoid cut.,fake_payment_portal
Cylinder delivery scheduled for 18 Sep 2024. Please keep Rs.4949 ready for driver.,benign
UPI refund pending. Claim now at hxxps://account-kyc(.)in/refund/Vj2cj?txn=FO7XJjt8vC&ref=5jfE613G,account_block_scam
Your electricity bill for this cycle is Rs. 6553. Use official portal https://discom.example.in/receipt/hZOuM.,benign
HP Gas Alert: Pending dues Rs.10862 on your account. Update KYC and pay at http://gasbill-3yaJ551.club/urgent immediately.,kyc_scam
BOI Security: Transaction of Rs.19366 from account 7800210174 is held. Verify identity at http://ebill-eG0wc.site/dues to release.,kyc_scam
WARNING: ALERT: Your bank account has been temporarily blocked. Verify KYC at https://t.co/PuPl4 immediately to restore access.,impersonation
ALERT: Water supply to your property will be disconnected for non-payment of Rs.3715. Act now: hxxps://gasbill-now(.)com/pay/my3SL,impersonation
Your electricity bill for this cycle is Rs. 9485. Use official portal https://billpay.example.in/receipt/dwi5E.,benign
"CESC Final Notice: Consumer 3355542080, pending payment Rs.7402. Pay via http://192.168.59.123/pay/OYHXDcJN before 8 PM or face disconnection.",impersonation
"Water Connection Suspension Notice: Account 5970495066, dues Rs.19777. Avoid stoppage - pay now via https://bsesdelhi-bill.U0Lutg.com/pay.",phishing_link
SIP of Rs.21866 processed for account 8320637775 on 23 May 2024. Ref: 13615680.,benign
UPI blocked: Your account 2116817327 flagged for review. Submit verification at https://icicisecure-p2WNku4X.com/login within 6 hours.,account_block_scam
"Dear Account Holder, your CIBIL score may be affected by unpaid EMI. Resolve at hxxp://powerco(.)net/urgent/Dh8fx6x. Ref: 52807643",kyc_scam
Water bill for this month is Rs. 2460. Pay using official portal http://waterpay.example.in/account/F7oWl,benign
