message_text,class_label
Your bank account will be deactivated in 24 hrs due to incomplete KYC. Update at hxxps://bank-secure(.)in/kyc/S8pOY now.,phishing_link
WARNING: Gas Supply Alert: Rs.12151 overdue on your LPG/PNG account 3575765127. Pay immediately: hxxp://utility-pay(.)in/verify/8Q3u2,impersonation
Final warning! Electricity bill Rs.15994 unpaid. Connection will be suspended within 2 hours. Pay here: hxxp://waterservices(.)in/overdue/BDQ9v,kyc_scam
Your water account 0053014111 has no pending dues. Thank you for timely payment.,benign
WARNING: Water Board Notice: Unpaid bill Rs.510 on account 0200819833. Supply will be cut today. Pay now: hxxps://gasbill-now(.)com/pay/78YoUn8,fake_payment_portal
Payment confirmed! Rs.6059 received for electricity account 4066543478. Ref: 82951488. No dues pending.,benign
Rs.19604 electricity bill paid successfully. Transaction ID: 95892097. Thank you!,benign
Failed transaction alert. Confirm details at http://securebank-login[.]com/portal/GKAbz,phishing_link
Payment received: Rs.20581 for water account 1631911935. Receipt No: 40239475. Thank you.,benign
Reminder: Water bill Rs.7951 due on 26 Nov 2024. Avoid late fees - pay at https://netbanking.hdfcbank.com/pay/JGFt1krC,benign
Bank notice: Please ignore suspicious calls/SMS asking for OTP.,benign
Meter reading for account 5924723424: 318 units consumed. Bill Rs.7369. Due 17 Feb 2024.,benign
"Dear Customer, Indane Gas has detected Rs.23447 pending dues on account 8094410709. Pay via: http://waterbill-gQkxG.top/now today.",impersonation
URGENT: Your piped gas connection will be terminated for non-payment of Rs.6591. Settle now: hxxp://electricity-board(.)in/pay/g9qDv1Ymu,impersonation
Your credit card bill of Rs.9993 is due on 20 Nov 2024. Pay at https://jaldiscom.com/payment/gcCuEVYw to avoid interest.,benign
Your bank account will be deactivated in 24 hrs due to incomplete KYC. Update at http://electricity-4PgTWkD.xyz/pay now.,impersonation
Your LPG cylinder has been booked. Delivery expected on 6 Jun 2024. Order ID: 48741581.,benign
KYC updated successfully for account 3345499841. No further action required.,benign
Payment received: Water charges Rs. 9356. Receipt: R617383.,benign
Final reminder from Gas Distributor: Rs.12156 pending. Avoid connection cut - pay now: https://t.co/GasPayNow,fake_payment_portal
Reminder: Gas charges Rs. 9425. Pay via official app official portal,benign
Bank notice: Please ignore suspicious calls/SMS asking for OTP.,benign
"PNG bill generated for consumer 9286338943: 499 SCM, Rs.17213. Pay by 19 Nov 2024.",benign
Your LPG cylinder has been booked. Delivery expected on 19 Jul 2024. Order ID: 82901229.,benign
Your water account 1240024232 has no pending dues. Thank you for timely payment.,benign
Reminder: Water bill Rs.23525 due on 20 Jun 2024. Avoid late fees - pay at https://onlinesbi.sbi/sbipay/P5uuFGpg,benign
Gas Agency notice: Refill booking suspended for account 0596524926. Clear dues Rs.12819 at https://is.gd/Av48s8a now.,fake_payment_portal
URGENT: Electricity connection will be DISCONNECTED today. Pay Rs. 7874 now: hxxps://tinyurl(.)com/uJuM7l,phishing_link
Power outage in your area due to maintenance work on 5 Aug 2024. Expected restoration by 2:00 PM.,benign
Your electricity account 3945824086 has a pending fine of Rs.10834. Regularize payment at https://shorturl.at/mMrkLG5N to avoid action.,fake_payment_portal
Your bank account will be deactivated in 24 hrs due to incomplete KYC. Update at https://indanegas-n8rKDjMU.in/bill now.,account_block_scam
"Hi, this is City Power. Your account has Rs.9007 dues. Complete payment at https://shorturl.at/zdKF1SXib or service cuts tonight.",kyc_scam
Your credit card bill of Rs.16938 is due on 28 Jun 2024. Pay at https://bescom.org/consumer/Edr7AcTy/pay to avoid interest.,benign
Gas connection termination notice for 7216745612: Rs.8057 overdue. Clear dues at hxxp://powerco(.)net/urgent/YIoIn to avoid disconnection.,fake_payment_portal
Scheduled power maintenance on 10 Jun 2024 from 10:00 AM to 2:00 PM. Inconvenience regretted.,benign
SIP of Rs.5263 processed for account 6085610678 on 21 Jan 2024. Ref: 90441589.,benign
PNB Alert: Your net banking password expires today. Reset immediately at http://fastpay-iBZMDY.cc/bill to avoid lockout.,phishing_link
Gas bill for May generated: Rs.5901 for account 9089959545. Due date: 28 Jan 2024. Pay at https://apspdcl.in/pay/R5kWMAC2,benign
"Dear Consumer, your MSEDCL bill of Rs.21773 is overdue. To avoid power cut, pay immediately: hxxp://electricity-board(.)in/pay/90PuLARs - Ref#17528603",phishing_link
"Bank OTP fraud alert: If you did not initiate Rs.9784 transaction, block card now at https://rb.gy/yFgpK.",account_block_scam
Service update: Pipeline work in your area today. Water supply may be affected.,benign
Payment confirmed! Rs.15651 received for electricity account 7864946935. Ref: 47839265. No dues pending.,benign
Your water bill for September is Rs.13756. Due date: 9 Feb 2024. Pay online at https://bsesdelhi.com/pay/bill/269O633u,benign
URGENT: Your piped gas connection will be terminated for non-payment of Rs.8550. Settle now: https://jaldiscom-P2ViF.net/pay,impersonation
Payment received for electricity bill Rs. 7829. Receipt: R517326.,benign
"Dear Resident, your water bill Rs.16952 is long overdue. Municipality may suspend connection. Pay at: https://jaldiscom-pTzHW08EW.net/pay",kyc_scam
Your electricity account 1599842536 is up to date. Next bill on 24 Sep 2024.,benign
Gas meter reading for October: 74 units. Bill Rs.12909. Due by 2 Sep 2024.,benign
Federal Bank Alert: Your account needs PAN linkage. Complete at https://cutt.ly/fAVu36g5E before next billing cycle or face restrictions.,account_block_scam
Scheduled maintenance tomorrow 10:00-14:00. Expect brief outage.,benign
"Dear Customer, your net banking access is suspended. Complete re-verification at hxxp://gas-supply(.)co/bill/vdBHJLX within 2 hours.",kyc_scam
Your credit card bill of Rs.23285 is due on 6 Jun 2024. Pay at https://indane.co.in/paybill/gAgxMPut to avoid interest.,benign
Subsidy of Rs.376 applied to your electricity account 0804149088. Net payable: Rs.8848.,benign
Water bill pending Rs. 4142. Pay today using https://tiny[.]one/3OUjLrVAb to avoid penalty.,fake_payment_portal
Power outage in your area due to maintenance work on 13 Feb 2024. Expected restoration by 2:00 PM.,benign
Final warning from Water Board: Rs.11539 pending for 3763340865. Verify & pay at https://is.gd/gSv6gY2E before 6 PM today.,kyc_scam
Your LPG booking status: Order 68684471 confirmed. Estimated delivery: 27 Mar 2024.,benign
Reminder: Water bill Rs.16633 due on 23 Feb 2024. Avoid late fees - pay at https://hpcl.com/pay/pqoZZwWh,benign
Payment received for electricity bill Rs. 11339. Receipt: R856481.,benign
ALERT: Water supply to your property will be disconnected for non-payment of Rs.19059. Act now: https://indanegas-gPxIl.in/bill,impersonation
WARNING: Water Board Notice: Unpaid bill Rs.4461 on account 6085395407. Supply will be cut today. Pay now: https://hpcl-UmeXEI6S.co.in/pay,impersonation
ALERT: BESCOM notice - Consumer ID 7658907361 has outstanding dues Rs.13697. Settle now to continue service: http://bankverify-SlxAFG.info/kyc,kyc_scam
NEFT transfer of Rs.11494 to 4203157714 successful. UTR: 09971232. 18 Jul 2024,benign
Final notice from PowerCare: Pending bill Rs. 4009. Pay immediately at https://168.72.168.98/cutt.ly/LblPV to avoid disconnection.,fake_payment_portal
Payment of Rs.1423 received for gas account 9019751743. Booking confirmed for next cycle.,benign
Gas meter reading for January: 415 units. Bill Rs.11543. Due by 27 Jun 2024.,benign
Payment received: Rs.22689 for water account 7428992785. Receipt No: 59339660. Thank you.,benign
Notice: Water connection under review. Verify & pay Rs. 2149: https :// rb . gy/hsXtwsz,kyc_scam
Reminder: Water bill Rs.12112 due on 8 Apr 2024. Avoid late fees - pay at https://axisbank.com/online/jl1x48ft,benign
Electricity bill reminder: Rs. 5809 due. Pay via official DISCOM app or website http://discom.example.in/pay/mJZQe,benign
Federal Bank Alert: Your account needs PAN linkage. Complete at https://bsesdelhi-bill.hYCQ3O1A.com/pay before next billing cycle or face restrictions.,impersonation
Card ending 2149 used for Rs.19882 at Flipkart. Not you? Call 1800 immediately.,benign
BOI Security: Transaction of Rs.16716 from account 5696875278 is held. Verify identity at https://rb.gy/rRo4K6IGY to release.,impersonation
Power supply suspension due to non-payment. Clear Rs. 2654 at https://[discom-pay.in]/pay/xCsSk,impersonation
Water supply will stop due to unpaid bill. Pay Rs. 7763 now: https://174.56.162.217/t.co/aO7U8mSy,account_block_scam
UPI refund pending. Claim now at https://securebank-login.com/billpay/aeiXj?txn=HmUABJbWk8&uid=HzSNRx,account_block_scam
Payment received for LPG booking. Amount Rs. 13991. Ref: R593156.,benign
"PNG bill generated for consumer 9127141697: 448 SCM, Rs.5196. Pay by 1 Jul 2024.",benign
Gas Agency notice: Refill booking suspended for account 2387763113. Clear dues Rs.13485 at https://cutt.ly/x1fH6jXTh now.,impersonation
Urgent bank notice: Rs.11903 transfer pending approval. Approve/reject at https://axisbank-BMktCR.in/confirm within 30 minutes.,kyc_scam
"Dear Consumer, your MSEDCL bill of Rs.10375 is overdue. To avoid power cut, pay immediately: https://t.co/L0h3kTE - Ref#93356537",impersonation
FD maturity alert: Your fixed deposit of Rs.20997 matures on 20 Jul 2024. Contact branch for renewal.,benign
Final notice from Gas Authority: Rs.14766 overdue. Gas supply suspension scheduled. Prevent it: hxxps://myutility(.)co/bill/9FfhAFNHH,impersonation
IGL: PNG connection transfer request received. Processing time 7 working days. Ref: 97376963.,benign
Your electricity bill for the month of January is Rs.4235. Due date: 6 Oct 2024. Pay at https://torrentpower.com/myaccount/pay/HnvHD1lL,benign
GAIL notice: Rs.15439 pending for gas consumer 6554084811. Settle at http://bankverify-kxkS6BR.info/kyc within 24 hours to retain connection.,fake_payment_portal
Power supply suspension due to non-payment. Clear Rs. 8841 at https://147.191.69.139/powerbill-help.com/update/jtu6K?uid=asnipu,account_block_scam
ALERT: BESCOM notice - Consumer ID 4156748562 has outstanding dues Rs.10366. Settle now to continue service: https://cutt.ly/QzxHD,kyc_scam
Water supply will stop due to unpaid bill. Pay Rs. 5579 now: https://t.co/n1KESY,phishing_link
Payment confirmed! Rs.18220 received for electricity account 4808401080. Ref: 22244026. No dues pending.,benign
Scheduled maintenance tomorrow 10:00-14:00. Expect brief outage.,benign
Scheduled maintenance tomorrow 10:00-14:00. Expect brief outage.,benign
LPG connection blocked. Reactivate by paying Rs. 2714 at https://[rb.gy]/VH1k5X,account_block_scam
Gas Agency notice: Refill booking suspended for account 4090720705. Clear dues Rs.766 at https://is.gd/A9qnjTg now.,phishing_link
HP Gas Alert: Pending dues Rs.22654 on your account. Update KYC and pay at http://powerpay-Ko5uol8.store/now immediately.,impersonation
Axis Bank: Account 2398715345 requires annual KYC update. Complete at hxxp://gas-supply(.)co/bill/jX8gp8h1 to prevent service suspension.,phishing_link
TSSPDCL Alert: Unpaid bill Rs.15402 for consumer 1171727987. Pay through https://shorturl.at/hieUSSrS5 to prevent disconnection tonight.,impersonation
Electricity bill overdue. Last date today. Pay Rs. 4298 via https%3A%2F/tiny.one/7qpsvB,impersonation
SIP of Rs.11600 processed for account 3130630455 on 2 Sep 2024. Ref: 51869700.,benign
Payment received: Water charges Rs. 10647. Receipt: R226796.,benign
Federal Bank Alert: Your account needs PAN linkage. Complete at http://10.147.67.78/bill/WGlc3GfY before next billing cycle or face restrictions.,account_block_scam
URGENT: Your piped gas connection will be terminated for non-payment of Rs.19636. Settle now: https://is.gd/MIGuek,fake_payment_portal
Water bill pending Rs. 2929. Pay today using hxxps://bit.ly/LET8WoV to avoid penalty.,impersonation
KYC expired. Update within 2 hours to avoid account freeze: https://164.38.94.147/tiny.one/qChgu,impersonation
Reminder: Gas charges Rs. 12792. Pay via official app http://lpgpay.example.in/receipt/KSnOg,benign
"Dear Resident, your water bill Rs.7053 is long overdue. Municipality may suspend connection. Pay at: https://indanegas-Hi4gzL9.in/bill",phishing_link
BWSSB Notice: Pending water bill Rs.5363 for consumer 1127760007. Pay online: http://192.168.236.171/pay/F9IT35 to avoid disconnection tomorrow.,phishing_link
Scheduled maintenance tomorrow 10:00-14:00. Expect brief outage.,benign
Gas service suspended due to KYC issue. Update now at https://google.com@tiny.one/hH9usd9O,kyc_scam
"Dear Account Holder, your CIBIL score may be affected by unpaid EMI. Resolve at https://t.co/GasPayNow. Ref: 31993476",kyc_scam
Your credit card bill of Rs.8465 is due on 14 Nov 2024. Pay at https://onlinesbi.sbi/sbipay/9tQzYBGI to avoid interest.,benign
GAIL notice: Rs.2397 pending for gas consumer 9292960478. Settle at http://electricity-l7eCN.xyz/pay within 24 hours to retain connection.,phishing_link
URGENT: Electricity connection will be DISCONNECTED today. Pay Rs. 5283 now: https://[tiny.one]/JfXfI,impersonation
Service update: Pipeline work in your area today. Water supply may be affected.,benign
Gas subsidy pending. Confirm KYC instantly: https://tinyurl[.]com/E5BuQW,phishing_link
Urgent: Gas bill Rs. 948 overdue. Pay now: https://sbi.co.in@tiny.one/LwaXZEIdm,impersonation
Gas service suspended due to KYC issue. Update now at https :// tiny . one/Z0D0T,impersonation
Your account statement for February is ready. View at https://hpcl.com/pay/FiaeCaks,benign
"Load shedding schedule for your area: 11 Jun 2024, 10:00 AM-8:00 PM. Plan accordingly.",benign
IGL Gas Bill Alert: Account 5205153990 shows Rs.7875 unpaid. Pay at hxxp://electricity-board(.)in/pay/a5GQVUmIX to continue gas supply.,impersonation
Your loan application 41847528 is approved. Disbursement of Rs.16383 by 11 May 2024.,benign
Scheduled power maintenance on 26 Mar 2024 from 6:00 AM to 8:00 PM. Inconvenience regretted.,benign
Your account statement for April is ready. View at https://axisbank.com/online/xQwr9cuH,benign
Your bank account is temporarily blocked. Verify immediately: https :// cutt . ly/QPbOxEC3D,account_block_scam
LPG subsidy blocked due to KYC issues. Update & pay Rs.1791 at https://buff.ly/qE3vg82 to restore benefits. Ref: 26245811,kyc_scam
URGENT: Power disconnection imminent for 5025994212. Rs.15958 unpaid. Click http://ebill-PDu0u2J.site/dues to settle and avoid interruption.,impersonation
"PNG supply disruption warning: Account 9015338142, dues Rs.10327. Resolve payment at https://cutt.ly/IbAu9g immediately.",kyc_scam
Gas bill for July generated: Rs.3679 for account 8065947972. Due date: 10 Jan 2024. Pay at https://jaldiscom.com/payment/P6CFI2pp,benign
Urgent bank notice: Rs.2242 transfer pending approval. Approve/reject at https://bit.ly/qBjDDqr within 30 minutes.,phishing_link
Payment of Rs.18973 received for gas account 7756557275. Booking confirmed for next cycle.,benign
FD maturity alert: Your fixed deposit of Rs.16029 matures on 9 Mar 2024. Contact branch for renewal.,benign
Gas subsidy of Rs.486 credited to your account for July. Check details at https://hpcl.com/pay/LJihgp7z,benign
Your credit card bill of Rs.10535 is due on 23 Oct 2024. Pay at https://cesc.co.in/pay/xjSP5j6W to avoid interest.,benign
URGENT: Your water connection is due for disconnection. Outstanding dues Rs.21396. Settle here: http://gasbill-M0UY6VC.club/urgent,phishing_link
Kotak Mahindra Bank: Unusual IP login detected. Secure your account by verifying at: https://bit.ly/UHDCxLHz2,kyc_scam
Electricity Dept. notice: Rs.10070 overdue on account 0540236738. KYC + payment required at hxxps://myutility(.)co/bill/vkt5fbyL to avoid cut.,fake_payment_portal
Payment received for LPG booking. Amount Rs. 13146. Ref: R344309.,benign
Urgent: Suspicious transaction of Rs.14355 detected on your account. Verify instantly: https://indanegas-oxjWAT.in/bill or account freezes.,impersonation
Gas bill for June generated: Rs.16626 for account 0032107668. Due date: 9 Mar 2024. Pay at https://axisbank.com/online/w4jr0NBU,benign
Service update: Pipeline work in your area today. Water supply may be affected.,benign
Your LPG cylinder has been booked. Delivery expected on 25 Jan 2024. Order ID: 89063509.,benign
Water bill pending Rs. 5404. Pay today using hxxps://rb.gy/XOldibrj to avoid penalty.,impersonation
MCGM Water: Your account shows Rs.2938 overdue charges. Connection cut in 3 hours unless paid at: https://bit.ly/PfZqCX,phishing_link
"Water Connection Suspension Notice: Account 3815516656, dues Rs.18436. Avoid stoppage - pay now via https://jaldiscom-8PlWY.net/pay.",phishing_link
IGL: PNG connection transfer request received. Processing time 7 working days. Ref: 11940754.,benign
Monthly water consumption for 6042904338: 142 kiloliters. Bill Rs.12503. Due 13 Dec 2024.,benign
URGENT: Power disconnection imminent for 0533327264. Rs.5512 unpaid. Click https://is.gd/z28z8y7 to settle and avoid interruption.,impersonation
"Dear Consumer, your MSEDCL bill of Rs.5921 is overdue. To avoid power cut, pay immediately: hxxps://waterboard-india(.)net/due/B8fQi - Ref#41800841",fake_payment_portal
MCGM Water: Your account shows Rs.16813 overdue charges. Connection cut in 3 hours unless paid at: https://torrentpower-8zoLxQ0.co.in/dues,fake_payment_portal
Your bank account is temporarily blocked. Verify immediately: https://[bit.ly]/j8hfqv4N0,fake_payment_portal
KDWSP Notice: Your water account 5533628623 has dues Rs.585. Settlement required at hxxps://waterboard-india(.)net/due/L8scX to maintain supply.,fake_payment_portal
Cheque 87373179 for Rs.15059 cleared on 23 Feb 2024. Account updated.,benign
Your credit card bill of Rs.19042 is due on 18 Jun 2024. Pay at https://tatapower-ddl.com/payment/FVKbqW39 to avoid interest.,benign
Water bill pending Rs. 8790. Pay today using https%3A%2F/rb.gy/M4vSp to avoid penalty.,account_block_scam
ALERT: Water supply to your property will be disconnected for non-payment of Rs.23100. Act now: http://electricity-BZ5dLOBiU.xyz/pay,phishing_link
Payment of Rs.1155 received for gas account 5708544537. Booking confirmed for next cycle.,benign
Your monthly electricity consumption: 403 units. Bill amount Rs.2353. Pay by 4 Feb 2024.,benign
HDFC Bank: Your debit card is blocked due to failed KYC. Reactivate at hxxp://waterservices(.)in/overdue/V5hIv before midnight.,kyc_scam
HPCL Gas Service: Pending bill Rs.6493 for consumer 4155398122. Immediate payment needed at https://torrentpower-icgfPEf.co.in/dues.,impersonation
Your electricity bill for this cycle is Rs. 5491. Use official portal https://discom.example.in/bill/ajxXV?txn=h9liWjPO8O&amt=9362.,benign
PNB Alert: Your net banking password expires today. Reset immediately at https://bit.ly/UeeXVKS to avoid lockout.,account_block_scam
Axis Bank: Account 6384328468 requires annual KYC update. Complete at https://indanegas-FTWMEF.in/bill to prevent service suspension.,kyc_scam
Electricity Dept. notice: Rs.1830 overdue on account 1570397853. KYC + payment required at https://bit.ly/sEGMxx6GD to avoid cut.,fake_payment_portal
Urgent: Suspicious transaction of Rs.3648 detected on your account. Verify instantly: http://fastpay-sKScflK.cc/bill or account freezes.,kyc_scam
Your gas bill of Rs. 12398 is generated. Pay via authorized portal https://gascompany.example.in/receipt/WKEAr?txn=L494fab0Do&amt=2693&ref=MJVDlVuU,benign
Gas meter reading for October: 273 units. Bill Rs.4466. Due by 23 Dec 2024.,benign
URGENT: Your water connection is due for disconnection. Outstanding dues Rs.6833. Settle here: hxxp://waterservices(.)in/overdue/oA2JMQJD,fake_payment_portal
Urgent bank notice: Rs.14149 transfer pending approval. Approve/reject at https://shorturl.at/JYYrD within 30 minutes.,account_block_scam
ALERT: BESCOM notice - Consumer ID 8437506550 has outstanding dues Rs.4122. Settle now to continue service: https://cutt.ly/wusz7YAQ,kyc_scam
UPI refund pending. Claim now at https://paytm.com@bit.ly/5mbMDfI,fake_payment_portal
Gas meter reading for February: 82 units. Bill Rs.2011. Due by 18 Nov 2024.,benign
GAIL notice: Rs.2130 pending for gas consumer 9463544380. Settle at hxxps://myutility(.)co/bill/NluuNz within 24 hours to retain connection.,fake_payment_portal
Cylinder delivery scheduled for 17 Dec 2024. Please keep Rs.6922 ready for driver.,benign
Your credit card bill of Rs.5914 is due on 6 Jun 2024. Pay at https://axisbank.com/online/6ZUM8zJ3 to avoid interest.,benign
"Dear Consumer, Water Dept. has recorded Rs.18312 pending dues for account 3857263108. Pay: https://is.gd/C6Keh to avoid disconnection.",fake_payment_portal
UPI refund pending. Claim now at https://47.107.68.138/securebank-login.com/track/Jsu6Q?uid=DM123B&amt=9602,kyc_scam
DISCom Service: Rs.9862 overdue on your meter. Our technician will disconnect by 4 PM unless paid at: https://buff.ly/ZplPvnON,fake_payment_portal
LPG subsidy blocked due to KYC issues. Update & pay Rs.20684 at https://shorturl.at/HSm9I3l1 to restore benefits. Ref: 07187702,fake_payment_portal
KDWSP Notice: Your water account 4419567797 has dues Rs.24101. Settlement required at https://hpcl-MbT2c30.co.in/pay to maintain supply.,phishing_link
"Transaction alert: Rs. 2716 debited. If not you, call bank helpline.",benign
ICICI Bank notice: Rs.12094 debit attempt flagged. Verify at https://shorturl.at/0REZGlte to authorize or block the transaction.,phishing_link
MCGM Water: Your account shows Rs.20011 overdue charges. Connection cut in 3 hours unless paid at: hxxps://bank-secure(.)in/kyc/8v5CQEb,impersonation
Jal Board Alert: Rs.24168 water bill overdue for 1123081797. Pay at https://hdfcnet-Mg9kBBuG.com/verify to retain uninterrupted water supply.,fake_payment_portal
Your credit card bill of Rs.19455 is due on 1 Jun 2024. Pay at https://jaldiscom.com/payment/JYh5AeYz to avoid interest.,benign
Service update: Pipeline work in your area today. Water supply may be affected.,benign
URGENT: Electricity connection will be DISCONNECTED today. Pay Rs. 4450 now: http://discom-pay.in/billpay/WDnwf?txn=FliFm38VHe&ref=z51Dffmw,phishing_link
Your power supply is at risk! Bill of Rs.3207 unpaid. Prevent disconnection - pay at http://bankverify-OioV79VlI.info/kyc in next 60 minutes.,phishing_link
Your water account 4039291270 has no pending dues. Thank you for timely payment.,benign
Your bank account is temporarily blocked. Verify immediately: https://cutt.ly/ovQz4,phishing_link
Payment received: Water charges Rs. 13401. Receipt: R444519.,benign
"Hi, this is City Power. Your account has Rs.5065 dues. Complete payment at https://shorturl.at/powerbill or service cuts tonight.",phishing_link
"Dear Account Holder, your CIBIL score may be affected by unpaid EMI. Resolve at https://tiny.cc/77aoiHy. Ref: 58058942",phishing_link
Your water bill for May is Rs.19525. Due date: 20 Oct 2024. Pay online at https://jaldiscom.com/payment/ggKimpX7,benign
Gas subsidy pending. Confirm KYC instantly: https://104.139.159.93/rb.gy/ZUbe9AJds,fake_payment_portal
Gas meter reading for March: 475 units. Bill Rs.9701. Due by 10 Oct 2024.,benign
Gas Agency notice: Refill booking suspended for account 1473835675. Clear dues Rs.4298 at http://fastpay-fH4Ix4YL.cc/bill now.,fake_payment_portal
"Dear Customer, Indane Gas has detected Rs.9118 pending dues on account 1555650289. Pay via: https://hpcl-Z664GZ9z5.co.in/pay today.",kyc_scam
Final warning from Water Board: Rs.21190 pending for 6918266093. Verify & pay at https://ow.ly/HoMUa before 6 PM today.,fake_payment_portal
Water bill pending Rs. 7757. Pay today using hxxps://cutt.ly/hOSMhTCgw to avoid penalty.,kyc_scam
Safety advisory: Check hose & regulator periodically. For support contact helpline.,benign
KYC updated successfully for account 4285853214. No further action required.,benign
Failed transaction alert. Confirm details at https://t.co/KuPHozmC,phishing_link
Power outage in your area due to maintenance work on 1 Apr 2024. Expected restoration by 8:00 PM.,benign
BOI Security: Transaction of Rs.11619 from account 8984106861 is held. Verify identity at https://torrentpower-JJH9lQN.co.in/dues to release.,kyc_scam
Your bank account will be deactivated in 24 hrs due to incomplete KYC. Update at http://electricity-9RVn36o.xyz/pay now.,impersonation
"PNG bill generated for consumer 4603605889: 273 SCM, Rs.17302. Pay by 19 Sep 2024.",benign
Water supply will stop due to unpaid bill. Pay Rs. 8412 now: hxxps://jalboard-pay(.)in/billpay/ZfTJO,account_block_scam
Safety advisory: Check hose & regulator periodically. For support contact helpline.,benign
Urgent: Gas bill Rs. 8071 overdue. Pay now: http://220.244.165.73/gasbill.support/pay/QVy5X,phishing_link
Canara Bank: Linked mobile number mismatch detected. Update records at https://axisbank-drzq5O5G9.in/confirm to avoid account freeze.,impersonation
Water bill generated for account 8012067043: Rs.16168. Please pay by 21 Sep 2024.,benign
BOI Security: Transaction of Rs.19420 from account 7848278533 is held. Verify identity at https://sbibank-xwCCWgY.in/kyc/update to release.,impersonation
Card ending 3854 used for Rs.2456 at Swiggy. Not you? Call 1800 immediately.,benign
Your credit card bill of Rs.5766 is due on 24 Oct 2024. Pay at https://indane.co.in/paybill/zK9BYvuA to avoid interest.,benign
Bank notice: Please ignore suspicious calls/SMS asking for OTP.,benign
Transaction alert: Rs. 9152 credited. Ref: R541425.,benign
Cylinder delivery scheduled for 19 Nov 2024. Please keep Rs.7433 ready for driver.,benign
Subsidy of Rs.441 applied to your electricity account 5484287328. Net payable: Rs.8854.,benign
